"Status","Start Time","Stop Time","Duration in ms","Parent Suite","Suite","Sub Suite","Test Class","Test Method","Name","Description"
"failed","Wed Jun 07 14:55:12 GMT 2023","Wed Jun 07 14:55:18 GMT 2023","6346","IDP Project Tests","Smoke Tests","tests.Search.VerifyUpdatingSearchDropdownByFilter","tests.Search.VerifyUpdatingSearchDropdownByFilter","VerifyUpdatingSearchDropdownByFilter","Verify updating search dropdown by filter","Verify updating search dropdown by filter"
"failed","Wed Jun 07 14:45:49 GMT 2023","Wed Jun 07 14:45:55 GMT 2023","6394","IDP Project Tests","Smoke Tests","tests.Ordering.Checkout.VerifyAddingNewShippingAddressOnCheckout","tests.Ordering.Checkout.VerifyAddingNewShippingAddressOnCheckout","VerifyAddingNewShippingAddressOnCheckout","Verify adding a new shipping address on checkout","Verify adding a new shipping address on checkout"
"failed","Wed Jun 07 14:44:47 GMT 2023","Wed Jun 07 14:44:53 GMT 2023","6236","IDP Project Tests","Smoke Tests","tests.Navigation.VerifyTopRatedProductsOnItemsListPageContainCategoryTitle","tests.Navigation.VerifyTopRatedProductsOnItemsListPageContainCategoryTitle","VerifyTopRatedProductsOnItemsListPageContainCategoryTitle","Verify top rated products on items list page contain category title","Verify top rated products on items list page contain category title"
"failed","Wed Jun 07 14:53:25 GMT 2023","Wed Jun 07 14:53:31 GMT 2023","6345","IDP Project Tests","Smoke Tests","tests.Ordering.Cart_Flyout.VerifyCartFlyoutProductPrice","tests.Ordering.Cart_Flyout.VerifyCartFlyoutProductPrice","verifyCartFlyoutProductPrice","Verify cart flyout product price","Verify cart flyout product price"
"failed","Wed Jun 07 14:48:44 GMT 2023","Wed Jun 07 14:48:50 GMT 2023","6339","IDP Project Tests","Smoke Tests","tests.Ordering.Order_Details.VerifySelectedProductTitle","tests.Ordering.Order_Details.VerifySelectedProductTitle","verifySelectedProductTitle","Verify selected product title","Verify selected product title"
"failed","Wed Jun 07 14:53:04 GMT 2023","Wed Jun 07 14:53:10 GMT 2023","6248","IDP Project Tests","Smoke Tests","tests.Ordering.Cart.VerifyProceedToCheckoutButtonRedirectsToCheckoutPage","tests.Ordering.Cart.VerifyProceedToCheckoutButtonRedirectsToCheckoutPage","verifyProceedToCheckoutButtonRedirectsToCheckoutPage","Verify Proceed to Checkout button redirects to Checkout page","Verify Proceed to Checkout button redirects to Checkout page"
"failed","Wed Jun 07 14:55:34 GMT 2023","Wed Jun 07 14:55:40 GMT 2023","6339","IDP Project Tests","Smoke Tests","tests.Search.VerifyAutocompleteSuggestionsIncludeSearchValue","tests.Search.VerifyAutocompleteSuggestionsIncludeSearchValue","VerifyAutocompleteSuggestionsIncludeSearchValue","Verify autocomplete suggestions include search value","Verify autocomplete suggestions include search value"
"failed","Wed Jun 07 14:46:32 GMT 2023","Wed Jun 07 14:46:39 GMT 2023","6402","IDP Project Tests","Smoke Tests","tests.Ordering.Order_Confirmation.VerifyProceedToCheckoutButtonRedirectsToProductCheckoutPage","tests.Ordering.Order_Confirmation.VerifyProceedToCheckoutButtonRedirectsToProductCheckoutPage","verifyProceedToCheckoutButtonRedirectsToProductCheckoutPage","Verify Proceed to Checkout button redirects to Product Checkout page","Verify Proceed to Checkout button redirects to Product Checkout page"
"failed","Wed Jun 07 14:52:42 GMT 2023","Wed Jun 07 14:52:48 GMT 2023","6344","IDP Project Tests","Smoke Tests","tests.Search.VerifyPreviousSearchIsDisplayedAsSuggestion","tests.Search.VerifyPreviousSearchIsDisplayedAsSuggestion","verifyPreviousSearchIsDisplayedAsSuggestion","Verify previous search is displayed as suggestion","Verify previous search is displayed as suggestion"
"failed","Wed Jun 07 14:46:11 GMT 2023","Wed Jun 07 14:46:17 GMT 2023","6353","IDP Project Tests","Smoke Tests","tests.Ordering.Home_Page.VerifyProductAppearsInPickupWhereYouLeftSection","tests.Ordering.Home_Page.VerifyProductAppearsInPickupWhereYouLeftSection","verifyProductAppearsInPickupWhereYouLeftSection","Verify product appears in pick up where you left section","Verify product appears in pick up where you left section"
"failed","Wed Jun 07 14:52:21 GMT 2023","Wed Jun 07 14:52:27 GMT 2023","6340","IDP Project Tests","Smoke Tests","tests.Ordering.Order_Details.VerifySelectedProductFreeDeliveryDate","tests.Ordering.Order_Details.VerifySelectedProductFreeDeliveryDate","verifySelectedProductFreeDeliveryDate","Verify selected product free delivery date","Verify selected product free delivery date"
"passed","Wed Jun 07 14:45:23 GMT 2023","Wed Jun 07 14:45:34 GMT 2023","10776","IDP Project Tests","Smoke Tests","tests.Ordering.Cart_Flyout.VerifyCartFlyoutDeleteButtonRemovesProduct","tests.Ordering.Cart_Flyout.VerifyCartFlyoutDeleteButtonRemovesProduct","verifyCartFlyoutDeleteButtonRemovesProduct","Verify cart flyout delete button removes product","Verify cart flyout delete button removes product"
"failed","Wed Jun 07 14:47:52 GMT 2023","Wed Jun 07 14:47:59 GMT 2023","6352","IDP Project Tests","Smoke Tests","tests.Ordering.Cart_Flyout.VerifyCartFlyoutProductLinkRedirectsToProductDetailsPage","tests.Ordering.Cart_Flyout.VerifyCartFlyoutProductLinkRedirectsToProductDetailsPage","verifyCartFlyoutProductLinkRedirectsToProductDetailsPage","Verify cart flyout product link redirects to Product Details Page","Verify cart flyout product link redirects to Product Details Page"
"failed","Wed Jun 07 14:49:27 GMT 2023","Wed Jun 07 14:49:33 GMT 2023","6343","IDP Project Tests","Smoke Tests","tests.Ordering.Cart.VerifyAddedToCartProductsSubtotal","tests.Ordering.Cart.VerifyAddedToCartProductsSubtotal","verifyAddedToCartProductsSubtotal","Verify added to cart products subtotal","Verify added to cart products subtotal"
"failed","Wed Jun 07 14:54:51 GMT 2023","Wed Jun 07 14:54:57 GMT 2023","6362","IDP Project Tests","Smoke Tests","tests.Ordering.Cart_Flyout.VerifyCartFlyoutSubtotalPrice","tests.Ordering.Cart_Flyout.VerifyCartFlyoutSubtotalPrice","verifyCartFlyoutSubtotalPrice","Verify cart flyout subtotal price","Verify cart flyout subtotal price"
"failed","Wed Jun 07 14:47:31 GMT 2023","Wed Jun 07 14:47:37 GMT 2023","6340","IDP Project Tests","Smoke Tests","tests.Ordering.Cart.VerifyCartButtonRedirectsToCartPage","tests.Ordering.Cart.VerifyCartButtonRedirectsToCartPage","verifyCartButtonRedirectsToCartPage","Verify Cart button redirects to Cart page","Verify Cart button redirects to Cart page"
"failed","Wed Jun 07 14:47:09 GMT 2023","Wed Jun 07 14:47:16 GMT 2023","6372","IDP Project Tests","Smoke Tests","tests.Search.VerifySelectionOfAutocompleteSuggestion","tests.Search.VerifySelectionOfAutocompleteSuggestion","verifySelectionOfAutocompleteSuggestion","Verify selection of autocomplete suggestion","Verify selection of autocomplete suggestion"
"failed","Wed Jun 07 14:53:46 GMT 2023","Wed Jun 07 14:53:53 GMT 2023","6353","IDP Project Tests","Smoke Tests","tests.Ordering.Order_Confirmation.VerifyProductSuccessMessageIsDisplayed","tests.Ordering.Order_Confirmation.VerifyProductSuccessMessageIsDisplayed","verifyProductSuccessMessageIsDisplayed","Verify product success message is displayed","Verify product success message is displayed"
"passed","Wed Jun 07 14:48:14 GMT 2023","Wed Jun 07 14:48:29 GMT 2023","14641","IDP Project Tests","Smoke Tests","tests.Ordering.Order_Confirmation.VerifyProductSubtotalPrice","tests.Ordering.Order_Confirmation.VerifyProductSubtotalPrice","verifyProductSubtotalPrice","Verify product subtotal price","Verify product subtotal price"
"failed","Wed Jun 07 14:50:10 GMT 2023","Wed Jun 07 14:50:16 GMT 2023","6334","IDP Project Tests","Smoke Tests","tests.Ordering.Order_Confirmation.VerifyGoToCartButtonRedirectsToCartPage","tests.Ordering.Order_Confirmation.VerifyGoToCartButtonRedirectsToCartPage","verifyGoToCartButtonRedirectsToCartPage","Verify Go to Cart button redirects to cart page","Verify Go to Cart button redirects to cart page"
"failed","Wed Jun 07 14:51:59 GMT 2023","Wed Jun 07 14:52:06 GMT 2023","6346","IDP Project Tests","Smoke Tests","tests.Ordering.Order_Confirmation.VerifyProductImageIsDisplayed","tests.Ordering.Order_Confirmation.VerifyProductImageIsDisplayed","verifyProductImageIsDisplayed","Verify product image is displayed","Verify product image is displayed"
"passed","Wed Jun 07 14:51:32 GMT 2023","Wed Jun 07 14:51:44 GMT 2023","12674","IDP Project Tests","Smoke Tests","tests.Ordering.Cart_Flyout.VerifyCartFlyoutDisplayedAfterAddingItemToCart","tests.Ordering.Cart_Flyout.VerifyCartFlyoutDisplayedAfterAddingItemToCart","verifyCartFlyoutDisplayedAfterAddingItemToCart","Verify cart flyout is displayed after adding item to cart","Verify cart flyout is displayed after adding item to cart"
"passed","Wed Jun 07 14:50:32 GMT 2023","Wed Jun 07 14:50:40 GMT 2023","8586","IDP Project Tests","Smoke Tests","tests.Ordering.Order_Details.VerifySelectedProductPrice","tests.Ordering.Order_Details.VerifySelectedProductPrice","verifySelectedProductPrice","Verify selected product price","Verify selected product price"
"failed","Wed Jun 07 14:45:08 GMT 2023","Wed Jun 07 14:45:14 GMT 2023","6205","IDP Project Tests","Smoke Tests","tests.Ordering.Cart.VerifyCartButtonCounterWhenProductAddedToCart","tests.Ordering.Cart.VerifyCartButtonCounterWhenProductAddedToCart","verifyCartButtonCounterWhenProductAddedToCart","Verify cart button counter when product added to cart","Verify cart button counter when product added to cart"
"passed","Wed Jun 07 14:46:40 GMT 2023","Wed Jun 07 14:46:54 GMT 2023","14272","IDP Project Tests","Smoke Tests","tests.Ordering.Order_Details.VerifyAddToCartButtonRedirectsToOrderConfirmationPage","tests.Ordering.Order_Details.VerifyAddToCartButtonRedirectsToOrderConfirmationPage","verifyAddToCartButtonRedirectsToOrderConfirmationPage","Verify Add to Cart button redirects to Product Confirmation Page","Verify Add to Cart button redirects to Product Confirmation Page"
"failed","Wed Jun 07 14:49:06 GMT 2023","Wed Jun 07 14:49:12 GMT 2023","6371","IDP Project Tests","Smoke Tests","tests.Search.VerifySearchResultItemsContainSearchValue","tests.Search.VerifySearchResultItemsContainSearchValue","verifySearchResultItemsContainSearchValue","Verify search result contain search value","Verify search result contain search value"
"failed","Wed Jun 07 14:49:49 GMT 2023","Wed Jun 07 14:49:55 GMT 2023","6371","IDP Project Tests","Smoke Tests","tests.Ordering.Cart_Flyout.VerifyCartFlyoutGoToCartButtonRedirectsToCartPage","tests.Ordering.Cart_Flyout.VerifyCartFlyoutGoToCartButtonRedirectsToCartPage","verifyCartFlyoutGoToCartButtonRedirectsToCartPage","Verify cart flyout Go to Cart button redirects to Cart Page","Verify cart flyout Go to Cart button redirects to Cart Page"
"failed","Wed Jun 07 14:54:08 GMT 2023","Wed Jun 07 14:54:14 GMT 2023","6343","IDP Project Tests","Smoke Tests","tests.Search.VerifyAutocompleteFlyoutAppears","tests.Search.VerifyAutocompleteFlyoutAppears","verifyAutocompleteFlyoutAppears","Verify autocomplete flyout appears","Verify autocomplete flyout appears"
"failed","Wed Jun 07 14:51:17 GMT 2023","Wed Jun 07 14:51:23 GMT 2023","6352","IDP Project Tests","Smoke Tests","tests.Ordering.Cart.VerifyAddedToCartProductPrice","tests.Ordering.Cart.VerifyAddedToCartProductPrice","verifyAddedToCartProductPrice","Verify added to cart product price","Verify added to cart product price"
"failed","Wed Jun 07 14:54:29 GMT 2023","Wed Jun 07 14:54:36 GMT 2023","6375","IDP Project Tests","Smoke Tests","tests.Ordering.Cart.VerifyAddedToCartProductTitle","tests.Ordering.Cart.VerifyAddedToCartProductTitle","verifyAddedToCartProductTitle","Verify added to cart product title","Verify added to cart product title"
"failed","Wed Jun 07 14:50:55 GMT 2023","Wed Jun 07 14:51:02 GMT 2023","6358","IDP Project Tests","Smoke Tests","tests.Search.VerifySearchForItem","tests.Search.VerifySearchForItem","verifySearchForItem","Search for item","Search for item"
